{
  "$schema": "https://json-schema.org/draft/2020-12/schema",
  "$id": "mlv-app/dual-venue-leg/v1",
  "title": "Dual-Venue leg spec",
  "description": "A leg is defined ONCE and run by each venue whenever it is free (P1). legSpecSha256 in a receipt is the sha256 of this file's exact bytes, so editing a leg makes a new subject.",
  "type": "object",
  "required": ["schema", "legId", "card", "legType", "clipId", "playSeconds", "backends", "scaleFactor", "timeouts", "criteria"],
  "additionalProperties": false,
  "properties": {
    "schema": { "const": "mlv-app/dual-venue-leg/v1" },
    "legId": { "type": "string", "pattern": "^[a-z0-9][a-z0-9-]{1,62}$" },
    "card": { "type": "string", "pattern": "^[A-Z0-9][A-Z0-9-]{1,80}$", "description": "The card that declares this leg; venues.json roles are keyed by it." },
    "legType": { "enum": ["speed", "look"] },
    "clipId": { "type": "string", "pattern": "^[A-Za-z][0-9]{2}-[0-9]{3,4}$", "description": "A CONSENTED CLIP ID (never a path, never a tracked fixture: the fixtures are 2 and 16 frames and can never satisfy the owner's 20 s of real footage, so a fixture id is refused by the runner's admission gate, typed, and cannot even be written in a tracked leg). The runner also refuses a venue that has no owner-typed record for this id in venue-clip-consent.json." },
    "playSeconds": { "type": "integer", "minimum": 20, "maximum": 3600, "default": 25, "description": "The settled-playback window the job plays (generator -PlaySeconds). The owner's floor is 20 s; the clip must cover it and the run must advance that many distinct source frames, or the receipt is INVALID." },
    "backends": {
      "type": "array", "minItems": 1, "uniqueItems": true,
      "items": { "enum": ["cuda", "cpu"] },
      "description": "Every playback leg runs as cuda AND cpu on EVERY venue (Amendment 1 A1). 'gl' is reserved and not yet runnable."
    },
    "scaleFactor": { "type": "integer", "minimum": 1, "maximum": 16, "description": "The playback scale the leg REQUESTS. The receipt also records the scale the app actually rendered at (effectiveScale, read from the app's own run log); a leg whose run rendered at any other scale than the accepted one ends SCALE_NOT_HONOURED, never PASS." },
    "displayMode": { "enum": ["fullscreen", "windowed"], "description": "OPTIONAL (DUAL-VENUE-DISPLAY-MATRIX-1). The display mode the leg REQUESTS: 'fullscreen' (the default when the field is absent, so every existing leg is unchanged) or 'windowed' (the app's own --windowed: a normal maximized window with chrome). The receipt's display block carries the requested AND the observed mode (read from the app's own gui_smoke.window_placement line) and the window it presented in. FAIL CLOSED: a leg that ran in a different mode than it names (a requested-windowed leg that ran full screen), or that names a mode the run log cannot confirm, ends INVALID (DISPLAY_MODE_NOT_HONOURED), never PASS or FAIL." },
    "acceptedEffectiveScale": {
      "type": "object", "additionalProperties": false,
      "properties": {
        "cuda": { "type": "integer", "minimum": 1, "maximum": 16 },
        "cpu": { "type": "integer", "minimum": 1, "maximum": 16 }
      },
      "description": "OPTIONAL, per backend: the scale that backend is KNOWN to render at when it is not scaleFactor (the CUDA texture route clamps every requested scale other than 1 to 1: MainWindowGpuPreviewPolicy.h). A run that renders at exactly this scale passes with the receipt verdict DECLARED_CLAMP and both numbers in its outcomeDetail; any other rendered scale is SCALE_NOT_HONOURED. A leg that wants its requested scale on a backend declares nothing and lists no backend that cannot render it."
    },
    "generatorArgs": {
      "type": "object", "additionalProperties": false,
      "properties": {
        "telemetryArm": { "enum": ["HEAVY", "LIGHT"] },
        "cpuQuiescenceThresholdPercent": { "type": "number", "exclusiveMinimum": 0, "maximum": 100 },
        "forceLookAssist": { "type": "boolean", "description": "SPEED legs only (PLAYBACK-BACHELOR-PRESENT-JITTER-1): force Look Assist on WITHOUT a contact sheet (generator -ForceLookAssist -LookPaceLeg), so no GUI-thread framebuffer grab lands inside the timed Play. A look leg ignores it (its look block forces Look Assist)." },
        "lookFlavor": { "enum": ["classic", "cinematic", "film"], "description": "With forceLookAssist on a SPEED leg: the Look Assist flavor (generator -LookFlavor)." },
        "playbackRenderLookaheadFrames": { "type": "integer", "minimum": 0, "maximum": 3, "description": "With forceLookAssist on a SPEED leg: the playback render lookahead depth the app runs at (MLVAPP_PLAYBACK_RENDER_LOOKAHEAD_FRAMES; generator -PlaybackRenderLookaheadFrames). Absent: the app's default." },
        "playbackProcessing": { "enum": ["receipt", "subset"], "description": "OPTIONAL (CPU-DUALISO-REDUCED-ISO-NOTCH-1): the app's playback processing (generator -PlaybackProcessing, forwarded by the smoke runner as --playback-processing). 'receipt' turns fast playback processing off, so a cpu leg renders processed8 and the CPU reduced dual-ISO recon can engage; 'subset' is the smoke default. Absent: the job passes nothing (the smoke default)." },
        "swapInterval": { "enum": [0, 1], "description": "PLAYBACK-VSYNC-DEFAULT-1: the GL swap interval every playback surface requests (MLVAPP_SWAP_INTERVAL; generator -SwapInterval), any leg type. 1 = vsync. Absent: nothing is set and the app keeps its default (1: the VSync setting, which an automation run reads fresh), so the job is the text it was before." },
        "rawPrefetchDecoders": { "type": "integer", "minimum": 0, "maximum": 4, "description": "PLAYBACK-LJ92-DECODE-THROUGHPUT-1: the raw-uint16 prefetch decoder count the app runs at (generator -RawPrefetchDecoders). 0 = MLVAPP_DISABLE_RAW_UINT16_PREFETCH=1 (no prefetch); 1..4 = MLVAPP_RAW_UINT16_PREFETCH_DECODERS=<k>. Absent: the app's default (2). Any leg." },
        "disableLookAssist": { "type": "boolean", "description": "UPSTREAM-CPU-BASELINE-1: run the app with Look Assist OFF (generator -DisableLookAssist -> the smoke runner's -DisableLookAssist -> --no-look-assist; the run fails closed if the app still reports Look Assist enabled). The fork turns Look Assist on for every clip by default, so a no-look leg must ask. Never with forceLookAssist or on a look leg (the generator refuses the pair, typed). Absent: nothing is passed and the app keeps its default." },
        "cudaLaunchTimingMinMs": { "type": "number", "minimum": 0, "maximum": 10000, "description": "GPU-EVENT153-ROOTCAUSE-2: turns the CUDA backends' per-launch timer on (MLVAPP_CUDA_LAUNCH_TIMING=1) with this per-launch line threshold in ms (MLVAPP_CUDA_LAUNCH_TIMING_MIN_MS; generator -CudaLaunchTimingMinMs). 0 = a line for every launch; the first launch of each stage, every error and the per-stage summaries are always written (to stderr, kept in result.json). Absent: nothing is set, the timer stays OFF and the job is the text it was before. Any leg." },
        "presentTrace": { "type": "boolean", "description": "PLAYBACK-STARTUP-CATCHUP-BURST-1 r7: turns the app's per-present playback trace on (MLVAPP_PLAYBACK_PRESENT_TRACE=1; generator -PresentTrace): one playback_smoke.present_trace row per presented frame, written to the run log after the Play stops. Absent or false: nothing is set and the job is the text it was before. Any leg." },
        "firstPresentCapture": { "type": "boolean", "description": "PLAYBACK-STARTUP-WAIT-PREWARM-1: turns the app's first-present identity capture on (MLVAPP_SMOKE_FIRST_PRESENT_CAPTURE=1; generator -FirstPresentCapture): an untimed capture of the paused start frame before the measured Play and one right after the first present's swap, written into the contact-sheet dir as identity-pre-play.png, identity-first-present.png and identity.json (std, mean absolute difference, display frames). The second grab lands inside the measured interval, so such a leg is never counted for timing. Absent or false: nothing is set and the job is the text it was before. Any leg." },
        "unpaced": { "type": "boolean", "description": "CUDA-HEADROOM-1: an unpaced throughput leg. Sets MLVAPP_PLAYBACK_UNPACED=1 (an automation run hands the app's pace guard a pace of 0, so no advance waits on the clip's own fps) and passes -DropFrameMode off to the smoke (every frame is rendered and presented; generator -Unpaced). FAIL CLOSED: the leg is INVALID with UNPACED_NOT_HONOURED unless the run log shows playback_smoke.pace_unpaced active=1 drop_frame=0 for the measured session. Absent or false: nothing is set and the job is the text it was before. Any leg." },
        "scope": { "enum": ["none", "histogram", "waveform", "parade", "vectorscope"], "description": "PLAYBACK-SCOPES-OPTION-1: the live scope the GUI smoke forces on for the run (generator -Scope -> the smoke runner's -Scope -> the app's --scope, which also shows the edit area for any scope but none). Absent or 'none': the job passes -Scope none, the text it always was (edit area hidden, no scope). Any leg." },
        "scopeIntervalMs": { "type": "integer", "minimum": 0, "maximum": 1000, "description": "PLAYBACK-SCOPES-OPTION-1: the base interval of the app's playback scope throttle (MLVAPP_PLAYBACK_SCOPE_INTERVAL_MS; generator -ScopeIntervalMs). 0 = no base interval (a scope update every presented frame when the render is fast, upstream's behaviour). Absent: nothing is set and the app keeps its default (150 ms), so the job is the text it was before. Any leg." },
        "scopesDuringPlayback": { "enum": ["hide", "throttled", "live"], "description": "PLAYBACK-SCOPES-OPTION-1 r4: the app's \"Scopes During Playback\" mode for the run (MLVAPP_PLAYBACK_SCOPES_DURING_PLAYBACK; generator -ScopesDuringPlayback), honoured only in an automation run and disclosed on one log line. The app defaults to hide, which computes no scope while playing, so a scope leg must pin throttled or live. Absent: nothing is set and the job is the text it was before (a build without the setting ignores it). Any leg." }
      },
      "description": "Generator arguments other than -Venue/-Backend/-ScaleFactor/-SourceCommit/-BuildManifestSha256/-ClipId (the runner sets those)."
    },
    "visualCapture": { "type": "boolean", "description": "OPTIONAL (PLAYBACK-VISUAL-INSPECTION-1). ABSENT MEANS ON for every speed leg: after the measured Play ends and its numbers are written, the app keeps playing ~3 s UNTIMED and the job keeps window captures (PrintWindow) a reviewer opens -- 6 play frames, the frame on screen the instant Play is paused, and that frame re-rendered by the paused full-quality path -- plus one contact strip. false is the opt-out and needs visualCaptureOptOutReason. A look leg is judged on its contact sheet and never runs this capture." },
    "visualCaptureOptOutReason": { "type": "string", "minLength": 12, "description": "Why this speed leg keeps no window captures (required with visualCapture false, refused otherwise). Recorded verbatim in the receipt's visual block." },
    "presentTearingExpectedReason": { "type": "string", "minLength": 12, "description": "CUDA-HEADROOM-1 r2: why PresentMon's AllowsTearing=1 on this leg's presents is the expected result and not a defect. Allowed ONLY on an unpaced leg at swap interval 0 (generatorArgs.unpaced true AND generatorArgs.swapInterval 0), refused otherwise, so a paced or vsync leg can never carry it. The runner and the job ignore it; the hub's playback-health scan reads it from the committed spec named by the receipt's legId to exempt that leg's TEARING flag." },
    "timeouts": {
      "type": "object", "required": ["queueWaitSec", "extraClaimedWaitSec"], "additionalProperties": false,
      "properties": {
        "queueWaitSec": { "type": "integer", "minimum": 30, "maximum": 86400 },
        "extraClaimedWaitSec": { "type": "integer", "minimum": 0, "maximum": 86400 }
      }
    },
    "look": {
      "type": "object", "required": ["contactSheetFrames", "lookFlavor"], "additionalProperties": false,
      "properties": {
        "contactSheetFrames": { "type": "integer", "minimum": 1, "maximum": 60 },
        "lookFlavor": { "enum": ["classic", "cinematic", "film"], "default": "classic" },
        "receipt": { "type": "string", "pattern": "^look-receipts/[a-z0-9-]+\\.marxml$", "description": "OPTIONAL (LOOK-ASSIST-FILM-FLAVOR-2 r2): a receipt file relative to tools/profiling/dual-venue/. The GUI smoke applies it before playback (--receipt). The runner reads it as COMMITTED at the admission head, never from the working copy. A measurement instrument (for example AgX off, so a capture can be re-graded frame-locked), not a product setting." },
        "receiptSha256": { "type": "string", "pattern": "^[0-9a-f]{64}$", "description": "sha256 of the committed receipt bytes. legSpecSha256 binds this hash, and so the receipt's bytes; a mismatch refuses the leg (LOOK_RECEIPT_UNBOUND)." }
      },
      "dependentRequired": { "receipt": ["receiptSha256"], "receiptSha256": ["receipt"] },
      "description": "Required when legType is 'look'. Look Assist is FORCED on for a look leg (Amendment 1 A2)."
    },
    "criteria": {
      "type": "object", "required": ["acceptance", "supplementary"], "additionalProperties": false,
      "description": "Per venue ROLE (P3) and per backend: criteria evaluated against the metrics copied verbatim from summary.json. An empty list is informational (no gating).",
      "properties": {
        "acceptance": { "$ref": "#/$defs/perBackend" },
        "supplementary": { "$ref": "#/$defs/perBackend" }
      }
    }
  },
  "allOf": [
    { "if": { "properties": { "legType": { "const": "look" } } }, "then": { "required": ["look"] } },
    { "if": { "properties": { "visualCapture": { "const": false } }, "required": ["visualCapture"] }, "then": { "required": ["visualCaptureOptOutReason"] }, "else": { "not": { "required": ["visualCaptureOptOutReason"] } } },
    { "if": { "required": ["presentTearingExpectedReason"] }, "then": { "required": ["generatorArgs"], "properties": { "generatorArgs": { "required": ["unpaced", "swapInterval"], "properties": { "unpaced": { "const": true }, "swapInterval": { "const": 0 } } } } } }
  ],
  "$defs": {
    "perBackend": {
      "type": "object", "additionalProperties": false,
      "properties": { "cuda": { "$ref": "#/$defs/criteriaList" }, "cpu": { "$ref": "#/$defs/criteriaList" } }
    },
    "criteriaList": {
      "type": "array",
      "items": {
        "type": "object", "required": ["metric", "op", "value"], "additionalProperties": false,
        "properties": {
          "metric": { "type": "string" },
          "op": { "enum": ["eq", "ne", "gt", "ge", "lt", "le"] },
          "value": {}
        }
      }
    }
  }
}
