{
  "schema": "mlv-app/dual-venue-leg/v1",
  "legId": "m16-1243-headroom-stage-fullscreen-s1",
  "card": "CUDA-HEADROOM-1",
  "legType": "speed",
  "clipId": "M16-1243",
  "playSeconds": 20,
  "backends": [
    "cuda",
    "cpu"
  ],
  "scaleFactor": 1,
  "displayMode": "fullscreen",
  "generatorArgs": {
    "telemetryArm": "HEAVY",
    "cpuQuiescenceThresholdPercent": 95,
    "forceLookAssist": true,
    "lookFlavor": "cinematic",
    "swapInterval": 0,
    "unpaced": true,
    "presentTrace": true,
    "cudaLaunchTimingMinMs": 0
  },
  "timeouts": {
    "queueWaitSec": 900,
    "extraClaimedWaitSec": 600
  },
  "criteria": {
    "acceptance": {
      "cuda": [
        {
          "metric": "lookAssistForced",
          "op": "eq",
          "value": true
        },
        {
          "metric": "gpuFramesTotal",
          "op": "gt",
          "value": 0
        },
        {
          "metric": "lookFlavorReported",
          "op": "eq",
          "value": "cinematic"
        }
      ],
      "cpu": [
        {
          "metric": "lookAssistForced",
          "op": "eq",
          "value": true
        },
        {
          "metric": "lookFlavorReported",
          "op": "eq",
          "value": "cinematic"
        }
      ]
    },
    "supplementary": {
      "cuda": [
        {
          "metric": "lookAssistForced",
          "op": "eq",
          "value": true
        },
        {
          "metric": "gpuFramesTotal",
          "op": "gt",
          "value": 0
        },
        {
          "metric": "lookFlavorReported",
          "op": "eq",
          "value": "cinematic"
        }
      ],
      "cpu": [
        {
          "metric": "lookAssistForced",
          "op": "eq",
          "value": true
        },
        {
          "metric": "lookFlavorReported",
          "op": "eq",
          "value": "cinematic"
        }
      ]
    }
  }
}
