{
  "schema": "mlv-app/dual-venue-leg/v1",
  "legId": "m16-1243-speed-fullscreen-s1",
  "card": "PLAYBACK-CPU-VISUAL-CAPTURE-TIMING-1",
  "legType": "speed",
  "clipId": "M16-1243",
  "playSeconds": 25,
  "backends": ["cuda", "cpu"],
  "scaleFactor": 1,
  "displayMode": "fullscreen",
  "generatorArgs": { "telemetryArm": "LIGHT", "cpuQuiescenceThresholdPercent": 95 },
  "timeouts": { "queueWaitSec": 900, "extraClaimedWaitSec": 600 },
  "criteria": {
    "acceptance": {
      "cuda": [
        { "metric": "gpuFramesTotal", "op": "gt", "value": 0 }
      ],
      "cpu": []
    },
    "supplementary": {
      "cuda": [
        { "metric": "gpuFramesTotal", "op": "gt", "value": 0 }
      ],
      "cpu": []
    }
  }
}
