{
  "schema": "mlv-app/dual-venue-leg/v1",
  "legId": "m16-1243-look-cinematic",
  "card": "DUAL-VENUE-EVIDENCE-1",
  "legType": "look",
  "clipId": "M16-1243",
  "playSeconds": 25,
  "backends": ["cuda", "cpu"],
  "scaleFactor": 4,
  "generatorArgs": { "telemetryArm": "LIGHT", "cpuQuiescenceThresholdPercent": 95 },
  "timeouts": { "queueWaitSec": 900, "extraClaimedWaitSec": 600 },
  "look": { "contactSheetFrames": 6, "lookFlavor": "cinematic" },
  "criteria": {
    "acceptance": {
      "cuda": [
        { "metric": "lookAssistForced", "op": "eq", "value": true },
        { "metric": "gpuFramesTotal", "op": "gt", "value": 0 }
      ],
      "cpu": [
        { "metric": "lookAssistForced", "op": "eq", "value": true }
      ]
    },
    "supplementary": {
      "cuda": [
        { "metric": "lookAssistForced", "op": "eq", "value": true },
        { "metric": "gpuFramesTotal", "op": "gt", "value": 0 }
      ],
      "cpu": [
        { "metric": "lookAssistForced", "op": "eq", "value": true }
      ]
    }
  }
}
