{
  "schema": "mlv-app/dual-venue-leg/v1",
  "legId": "m16-1243-scopes-cuda-windowed-s1-waveform-i0",
  "card": "PLAYBACK-SCOPES-OPTION-1",
  "legType": "speed",
  "clipId": "M16-1243",
  "playSeconds": 25,
  "backends": ["cuda"],
  "scaleFactor": 1,
  "displayMode": "windowed",
  "generatorArgs": { "telemetryArm": "LIGHT", "cpuQuiescenceThresholdPercent": 95, "disableLookAssist": true, "scope": "waveform", "scopeIntervalMs": 0 },
  "timeouts": { "queueWaitSec": 900, "extraClaimedWaitSec": 600 },
  "criteria": {
    "acceptance": { "cuda": [] },
    "supplementary": { "cuda": [] }
  }
}
