{
  "schema": "mlv-app/dual-venue-leg/v1",
  "legId": "m16-1243-scopes-cuda-windowed-s4-histogram-la",
  "card": "PLAYBACK-GPU-SCOPES-NO-VETO-1",
  "legType": "speed",
  "clipId": "M16-1243",
  "playSeconds": 25,
  "backends": ["cuda"],
  "scaleFactor": 4,
  "displayMode": "windowed",
  "generatorArgs": { "telemetryArm": "LIGHT", "cpuQuiescenceThresholdPercent": 95, "forceLookAssist": true, "scope": "histogram", "scopesDuringPlayback": "throttled" },
  "timeouts": { "queueWaitSec": 900, "extraClaimedWaitSec": 600 },
  "criteria": {
    "acceptance": { "cuda": [ { "metric": "lookAssistForced", "op": "eq", "value": true }, { "metric": "gpuFramesTotal", "op": "gt", "value": 0 }, { "metric": "cpuFrames", "op": "eq", "value": 0 }, { "metric": "scopeSource", "op": "eq", "value": "gpu_tap" }, { "metric": "scopeTapCompleted", "op": "gt", "value": 0 } ] },
    "supplementary": { "cuda": [ { "metric": "lookAssistForced", "op": "eq", "value": true }, { "metric": "gpuFramesTotal", "op": "gt", "value": 0 }, { "metric": "cpuFrames", "op": "eq", "value": 0 }, { "metric": "scopeSource", "op": "eq", "value": "gpu_tap" }, { "metric": "scopeTapCompleted", "op": "gt", "value": 0 } ] }
  }
}
