{
  "schema": "mlv-app/dual-venue-leg/v1",
  "legId": "m16-1243-scopes-cpu-windowed-s2-histogram-la",
  "card": "PLAYBACK-GPU-SCOPES-NO-VETO-1",
  "legType": "speed",
  "clipId": "M16-1243",
  "playSeconds": 25,
  "backends": ["cpu"],
  "scaleFactor": 2,
  "displayMode": "windowed",
  "generatorArgs": { "telemetryArm": "LIGHT", "cpuQuiescenceThresholdPercent": 95, "forceLookAssist": true, "scope": "histogram", "scopesDuringPlayback": "throttled" },
  "timeouts": { "queueWaitSec": 900, "extraClaimedWaitSec": 600 },
  "criteria": {
    "acceptance": { "cpu": [ { "metric": "lookAssistForced", "op": "eq", "value": true } ] },
    "supplementary": { "cpu": [ { "metric": "lookAssistForced", "op": "eq", "value": true } ] }
  }
}
