{
  "schema": "mlv-app/dual-venue-leg/v1",
  "legId": "m16-1243-display-windowed-s1-vis",
  "card": "DUAL-VENUE-DISPLAY-MATRIX-1",
  "legType": "look",
  "clipId": "M16-1243",
  "playSeconds": 25,
  "backends": ["cuda", "cpu"],
  "scaleFactor": 1,
  "displayMode": "windowed",
  "visualCapture": true,
  "generatorArgs": { "telemetryArm": "LIGHT", "cpuQuiescenceThresholdPercent": 95 },
  "timeouts": { "queueWaitSec": 900, "extraClaimedWaitSec": 600 },
  "look": { "contactSheetFrames": 6, "lookFlavor": "cinematic" },
  "criteria": {
    "acceptance": {
      "cuda": [
        { "metric": "lookAssistForced", "op": "eq", "value": true },
        { "metric": "gpuFramesTotal", "op": "gt", "value": 0 },
        { "metric": "lookFlavorReported", "op": "eq", "value": "cinematic" }
      ],
      "cpu": [
        { "metric": "lookAssistForced", "op": "eq", "value": true },
        { "metric": "lookFlavorReported", "op": "eq", "value": "cinematic" }
      ]
    },
    "supplementary": {
      "cuda": [
        { "metric": "lookAssistForced", "op": "eq", "value": true },
        { "metric": "gpuFramesTotal", "op": "gt", "value": 0 },
        { "metric": "lookFlavorReported", "op": "eq", "value": "cinematic" }
      ],
      "cpu": [
        { "metric": "lookAssistForced", "op": "eq", "value": true },
        { "metric": "lookFlavorReported", "op": "eq", "value": "cinematic" }
      ]
    }
  }
}
