{
  "schema": "mlv-app/dual-venue-leg/v1",
  "legId": "m16-1243-pace-cinematic-cpu-reduced-windowed-s4",
  "card": "PLAYBACK-BACHELOR-PRESENT-JITTER-1",
  "legType": "speed",
  "clipId": "M16-1243",
  "playSeconds": 25,
  "backends": ["cpu"],
  "scaleFactor": 4,
  "displayMode": "windowed",
  "generatorArgs": { "telemetryArm": "LIGHT", "cpuQuiescenceThresholdPercent": 95, "playbackProcessing": "receipt", "forceLookAssist": true, "lookFlavor": "cinematic" },
  "timeouts": { "queueWaitSec": 900, "extraClaimedWaitSec": 600 },
  "criteria": {
    "acceptance": {
      "cpu": [
        { "metric": "lookAssistForced", "op": "eq", "value": true },
        { "metric": "lookFlavorReported", "op": "eq", "value": "cinematic" }
      ]
    },
    "supplementary": {
      "cpu": [
        { "metric": "lookAssistForced", "op": "eq", "value": true },
        { "metric": "lookFlavorReported", "op": "eq", "value": "cinematic" }
      ]
    }
  }
}
