{
  "schema": "mlv-app/dual-venue-leg/v1",
  "legId": "m16-1243-upstream-baseline-cpu-fullscreen-s1",
  "card": "UPSTREAM-CPU-BASELINE-1",
  "legType": "speed",
  "clipId": "M16-1243",
  "playSeconds": 25,
  "backends": ["cpu"],
  "scaleFactor": 1,
  "displayMode": "fullscreen",
  "generatorArgs": { "telemetryArm": "LIGHT", "cpuQuiescenceThresholdPercent": 95, "disableLookAssist": true },
  "timeouts": { "queueWaitSec": 900, "extraClaimedWaitSec": 600 },
  "criteria": {
    "acceptance": { "cpu": [] },
    "supplementary": { "cpu": [] }
  }
}