{
  "schema": "mlv-app/dual-venue-leg/v1",
  "legId": "m16-1243-cpu-reduced-fullscreen-s4",
  "card": "CPU-DUALISO-REDUCED-ISO-NOTCH-1",
  "legType": "look",
  "clipId": "M16-1243",
  "playSeconds": 25,
  "backends": ["cpu"],
  "scaleFactor": 4,
  "displayMode": "fullscreen",
  "generatorArgs": { "telemetryArm": "LIGHT", "cpuQuiescenceThresholdPercent": 95, "playbackProcessing": "receipt" },
  "timeouts": { "queueWaitSec": 900, "extraClaimedWaitSec": 600 },
  "look": { "contactSheetFrames": 6, "lookFlavor": "cinematic" },
  "criteria": {
    "acceptance": {
      "cpu": [
        { "metric": "lookAssistForced", "op": "eq", "value": true },
        { "metric": "lookFlavorReported", "op": "eq", "value": "cinematic" }
      ]
    },
    "supplementary": {
      "cpu": [
        { "metric": "lookAssistForced", "op": "eq", "value": true },
        { "metric": "lookFlavorReported", "op": "eq", "value": "cinematic" }
      ]
    }
  }
}