{
  "schema": "mlv-app/dual-venue-leg/v1",
  "legId": "m16-1457-headroom-stage-fullscreen-s4",
  "card": "CUDA-HEADROOM-1",
  "legType": "speed",
  "clipId": "M16-1457",
  "playSeconds": 20,
  "backends": [
    "cuda",
    "cpu"
  ],
  "scaleFactor": 4,
  "displayMode": "fullscreen",
  "generatorArgs": {
    "telemetryArm": "HEAVY",
    "cpuQuiescenceThresholdPercent": 95,
    "forceLookAssist": true,
    "lookFlavor": "cinematic",
    "swapInterval": 0,
    "unpaced": true,
    "presentTrace": true,
    "cudaLaunchTimingMinMs": 0
  },
  "visualCapture": false,
  "visualCaptureOptOutReason": "unpaced throughput/stage leg: the untimed capture tail keeps playing unpaced past the measured window, so its presents count against the header-frame loop check and blur the measured rate",
  "presentTearingExpectedReason": "unpaced headroom leg at swap interval 0: every present goes out with SyncInterval 0, so PresentMon reports AllowsTearing=1 on its Independent Flip presents by design; a measurement-only mode (MLVAPP_PLAYBACK_UNPACED is honoured only in an automation run) that no user playback path reaches",
  "timeouts": {
    "queueWaitSec": 900,
    "extraClaimedWaitSec": 600
  },
  "criteria": {
    "acceptance": {
      "cuda": [
        {
          "metric": "lookAssistForced",
          "op": "eq",
          "value": true
        },
        {
          "metric": "gpuFramesTotal",
          "op": "gt",
          "value": 0
        },
        {
          "metric": "lookFlavorReported",
          "op": "eq",
          "value": "cinematic"
        }
      ],
      "cpu": [
        {
          "metric": "lookAssistForced",
          "op": "eq",
          "value": true
        },
        {
          "metric": "lookFlavorReported",
          "op": "eq",
          "value": "cinematic"
        }
      ]
    },
    "supplementary": {
      "cuda": [
        {
          "metric": "lookAssistForced",
          "op": "eq",
          "value": true
        },
        {
          "metric": "gpuFramesTotal",
          "op": "gt",
          "value": 0
        },
        {
          "metric": "lookFlavorReported",
          "op": "eq",
          "value": "cinematic"
        }
      ],
      "cpu": [
        {
          "metric": "lookAssistForced",
          "op": "eq",
          "value": true
        },
        {
          "metric": "lookFlavorReported",
          "op": "eq",
          "value": "cinematic"
        }
      ]
    }
  }
}
