{
  "schema": "mlv-app/dual-venue-leg/v1",
  "legId": "m16-1243-look-scale2-film-agxoff",
  "card": "DUAL-VENUE-EVIDENCE-1",
  "legType": "look",
  "clipId": "M16-1243",
  "playSeconds": 25,
  "backends": ["cuda", "cpu"],
  "scaleFactor": 2,
  "generatorArgs": { "telemetryArm": "LIGHT", "cpuQuiescenceThresholdPercent": 95 },
  "timeouts": { "queueWaitSec": 900, "extraClaimedWaitSec": 600 },
  "look": { "contactSheetFrames": 6, "lookFlavor": "film", "receipt": "look-receipts/agx-off.marxml", "receiptSha256": "1481809362b949466bd8c85cd602afea52cc8a4a0ae5c134ed287a8c272f09de" },
  "criteria": {
    "acceptance": {
      "cuda": [
        { "metric": "lookAssistForced", "op": "eq", "value": true },
        { "metric": "gpuFramesTotal", "op": "gt", "value": 0 },
        { "metric": "lookFlavorReported", "op": "eq", "value": "film" }
      ],
      "cpu": [
        { "metric": "lookAssistForced", "op": "eq", "value": true },
        { "metric": "lookFlavorReported", "op": "eq", "value": "film" }
      ]
    },
    "supplementary": {
      "cuda": [
        { "metric": "lookAssistForced", "op": "eq", "value": true },
        { "metric": "gpuFramesTotal", "op": "gt", "value": 0 },
        { "metric": "lookFlavorReported", "op": "eq", "value": "film" }
      ],
      "cpu": [
        { "metric": "lookAssistForced", "op": "eq", "value": true },
        { "metric": "lookFlavorReported", "op": "eq", "value": "film" }
      ]
    }
  }
}
